{
  "schemaVersion": 1,
  "model": "de442s-mean-sphere-eclipse-candidates-v1",
  "source": {
    "ephemeris": "JPL DE442s",
    "kernelUrl": "https://naif.jpl.nasa.gov/pub/naif/generic_kernels/spk/planets/de442s.bsp",
    "kernelSha256": "54d97562a5b094d298b1b8eafa5a2e17e3e010ce85e1a366d07f003ad159323c",
    "kernelByteLength": 32701440,
    "starCatalog": {
      "id": "NASA HEASARC BSC5P bright-stars.v2",
      "artifact": "shared/catalog/bright-stars.v2.json",
      "referenceSystem": "FK5",
      "epoch": "J2000.0",
      "sourceUrl": "https://heasarc.gsfc.nasa.gov/W3Browse/catalog/bsc5p.html",
      "sourceSha256": "a30e96d261ad5aea5d6f919828aa35bf08362fde0eca2062ea6e5ee3a796508b",
      "starsContentSha256": "4e1a2de053ce13bb60027b66588fb396eada244a219d19c824cad32278043856"
    },
    "nasaCatalogs": [
      {
        "kind": "solar-eclipse",
        "startYear": 1901,
        "endYear": 2000,
        "expectedCount": 228,
        "url": "https://eclipse.gsfc.nasa.gov/SEcat5/SE1901-2000.html"
      },
      {
        "kind": "solar-eclipse",
        "startYear": 2001,
        "endYear": 2100,
        "expectedCount": 224,
        "url": "https://eclipse.gsfc.nasa.gov/SEcat5/SE2001-2100.html"
      },
      {
        "kind": "lunar-eclipse",
        "startYear": 1901,
        "endYear": 2000,
        "expectedCount": 229,
        "url": "https://eclipse.gsfc.nasa.gov/LEcat5/LE1901-2000.html"
      },
      {
        "kind": "lunar-eclipse",
        "startYear": 2001,
        "endYear": 2100,
        "expectedCount": 228,
        "url": "https://eclipse.gsfc.nasa.gov/LEcat5/LE2001-2100.html"
      }
    ]
  },
  "coverage": {
    "calendar": "proleptic Gregorian",
    "timeScale": "TDB",
    "startYear": 1900,
    "endYear": 2101,
    "endIsExclusive": true,
    "chunkYears": 5
  },
  "generation": {
    "scanStepDays": 0.5,
    "maximumToleranceSeconds": 1,
    "localSearchHalfWindowDays": 0.75,
    "solarCandidateRule": "At the minimum geocentric shadow-axis miss distance, retain the event when the mean spherical Earth intersects the Moon's penumbral cone. Lunar radii k1/k2 follow the NASA Besselian convention.",
    "lunarCandidateRule": "At minimum Moon-to-antisolar-axis separation, retain the event when the mean lunar disk intersects the Danjon 1.01 penumbra.",
    "occultationCandidateRule": "For bundled BSC5P stars at V <= 3.0 and within 8 degrees of the J2000 ecliptic, retain a minimum when the geocentric separation is no greater than lunar semidiameter plus maximum equatorial lunar parallax plus a 120 arcsecond inclusion margin.",
    "occultationScanStepDays": 0.125,
    "occultationSelectedStarCount": 25,
    "occultationSelectedStars": [
      {
        "hr": 1165,
        "vMagnitude": 2.87,
        "eclipticLatitudeRadians": 0.07069983077
      },
      {
        "hr": 1457,
        "vMagnitude": 0.85,
        "eclipticLatitudeRadians": -0.095424720752
      },
      {
        "hr": 1791,
        "vMagnitude": 1.65,
        "eclipticLatitudeRadians": 0.093988839233
      },
      {
        "hr": 1910,
        "vMagnitude": 3,
        "eclipticLatitudeRadians": -0.038321574845
      },
      {
        "hr": 2286,
        "vMagnitude": 2.88,
        "eclipticLatitudeRadians": -0.014313395369
      },
      {
        "hr": 2421,
        "vMagnitude": 1.93,
        "eclipticLatitudeRadians": -0.117681336064
      },
      {
        "hr": 2473,
        "vMagnitude": 2.98,
        "eclipticLatitudeRadians": 0.036127491427
      },
      {
        "hr": 2990,
        "vMagnitude": 1.14,
        "eclipticLatitudeRadians": 0.11665909771
      },
      {
        "hr": 3982,
        "vMagnitude": 1.35,
        "eclipticLatitudeRadians": 0.008112958611
      },
      {
        "hr": 5056,
        "vMagnitude": 0.98,
        "eclipticLatitudeRadians": -0.035858213165
      },
      {
        "hr": 5531,
        "vMagnitude": 2.75,
        "eclipticLatitudeRadians": 0.00581472275
      },
      {
        "hr": 5944,
        "vMagnitude": 2.89,
        "eclipticLatitudeRadians": -0.095564517541
      },
      {
        "hr": 5953,
        "vMagnitude": 2.32,
        "eclipticLatitudeRadians": -0.034662595844
      },
      {
        "hr": 5984,
        "vMagnitude": 2.62,
        "eclipticLatitudeRadians": 0.017586598819
      },
      {
        "hr": 6084,
        "vMagnitude": 2.89,
        "eclipticLatitudeRadians": -0.070465301161
      },
      {
        "hr": 6134,
        "vMagnitude": 0.96,
        "eclipticLatitudeRadians": -0.079760268077
      },
      {
        "hr": 6165,
        "vMagnitude": 2.82,
        "eclipticLatitudeRadians": -0.106822501551
      },
      {
        "hr": 6378,
        "vMagnitude": 2.43,
        "eclipticLatitudeRadians": 0.125628531074
      },
      {
        "hr": 6746,
        "vMagnitude": 2.99,
        "eclipticLatitudeRadians": -0.122020146799
      },
      {
        "hr": 6859,
        "vMagnitude": 2.7,
        "eclipticLatitudeRadians": -0.112961180642
      },
      {
        "hr": 6913,
        "vMagnitude": 2.81,
        "eclipticLatitudeRadians": -0.03727295662
      },
      {
        "hr": 7121,
        "vMagnitude": 2.02,
        "eclipticLatitudeRadians": -0.060204401751
      },
      {
        "hr": 7194,
        "vMagnitude": 2.6,
        "eclipticLatitudeRadians": -0.125298523759
      },
      {
        "hr": 7264,
        "vMagnitude": 2.89,
        "eclipticLatitudeRadians": 0.025081913782
      },
      {
        "hr": 8322,
        "vMagnitude": 2.87,
        "eclipticLatitudeRadians": -0.045405685332
      }
    ],
    "constants": {
      "earthEquatorialRadiusKilometers": 6378.137,
      "earthPolarRadiusKilometers": 6356.752314245,
      "sunNominalRadiusKilometers": 695700,
      "moonMeanRadiusKilometers": 1737.4,
      "solarPenumbralLunarRadiusRatio": 0.272488,
      "solarUmbralLunarRadiusRatio": 0.272281,
      "lunarShadowDanjonScale": 1.01,
      "solarClassificationBoundaryToleranceKilometers": 1.5,
      "distanceUnit": "kilometer",
      "angleUnit": "radian"
    },
    "determinism": "Direct Float64 evaluation of the pinned DE442s Type 2 SPK; fixed half-day eclipse and three-hour occultation scans; one-second golden-section stopping width; canonical pretty-printed UTF-8 JSON."
  },
  "interpretation": {
    "purpose": "Small offline seeds for a later topocentric contact solver; candidates are not observer-specific predictions.",
    "classificationHint": "Mean-sphere geometry only. The runtime solver must recompute classification and local visibility. A sampled total path whose minimum umbra is within 1.5 km of zero is marked hybrid because a sub-minute transition and the mean lunar limb cannot be resolved by this index.",
    "uncertainty": "Mean lunar limb, spherical Earth candidate filter, and no atmosphere or lunar topography. Grazing contacts need a limb profile and site/EOP uncertainty. TDB seeds require the application time-scale pipeline before UTC display.",
    "occultationAstrometry": "BSC5P FK5 J2000 position and proper motion are connected to Hipparcos/ICRS with SOFA-derived rotation and spin. The broad 120 arcsecond margin covers omitted candidate-stage aberration, light time, catalog quantization, and perspective acceleration. The runtime must use its full apparent-position pipeline.",
    "searchWindow": "The stored +/-18 hour window intentionally exceeds all eclipse contact durations and absorbs seed/model differences.",
    "runtimeNetwork": "None. NASA pages are fetched only when the generator is invoked with --verify-nasa."
  },
  "chunks": [
    {
      "id": "1900-1905",
      "startYear": 1900,
      "endYear": 1905,
      "file": "shared/events/chunks/1900-1905.v1.json",
      "eventCount": 143,
      "solarEclipseCount": 11,
      "lunarEclipseCount": 11,
      "lunarOccultationCount": 121,
      "byteLength": 89652,
      "gzipByteLength": 9923,
      "sha256": "f8c8a46ba30f575a6f34bf50dee19eda8c92f5543f144a474d23701b2ca13d1a"
    },
    {
      "id": "1905-1910",
      "startYear": 1905,
      "endYear": 1910,
      "file": "shared/events/chunks/1905-1910.v1.json",
      "eventCount": 210,
      "solarEclipseCount": 12,
      "lunarEclipseCount": 12,
      "lunarOccultationCount": 186,
      "byteLength": 132804,
      "gzipByteLength": 14163,
      "sha256": "1f1010cf967b8b215f41c9e5ffb4b2e29581af54a3f75720cb95a7c388c6755a"
    },
    {
      "id": "1910-1915",
      "startYear": 1910,
      "endYear": 1915,
      "file": "shared/events/chunks/1910-1915.v1.json",
      "eventCount": 378,
      "solarEclipseCount": 11,
      "lunarEclipseCount": 10,
      "lunarOccultationCount": 357,
      "byteLength": 242532,
      "gzipByteLength": 24492,
      "sha256": "3dce5638aa9eaa26bf2ea1f24bdabd465832a5d088ede5201714556e0146ad0a"
    },
    {
      "id": "1915-1920",
      "startYear": 1915,
      "endYear": 1920,
      "file": "shared/events/chunks/1915-1920.v1.json",
      "eventCount": 321,
      "solarEclipseCount": 13,
      "lunarEclipseCount": 13,
      "lunarOccultationCount": 295,
      "byteLength": 204264,
      "gzipByteLength": 20948,
      "sha256": "abc1dfa69e09a2655da53982f72e152929f6df68e3a9a6e34897750e5ffb1d3b"
    },
    {
      "id": "1920-1925",
      "startYear": 1920,
      "endYear": 1925,
      "file": "shared/events/chunks/1920-1925.v1.json",
      "eventCount": 130,
      "solarEclipseCount": 11,
      "lunarEclipseCount": 11,
      "lunarOccultationCount": 108,
      "byteLength": 81661,
      "gzipByteLength": 9123,
      "sha256": "e3305513328052b3f796a87f9a427ca75a63e241da99a05e110e52e28aa1034b"
    },
    {
      "id": "1925-1930",
      "startYear": 1925,
      "endYear": 1930,
      "file": "shared/events/chunks/1925-1930.v1.json",
      "eventCount": 235,
      "solarEclipseCount": 12,
      "lunarEclipseCount": 12,
      "lunarOccultationCount": 211,
      "byteLength": 148709,
      "gzipByteLength": 15721,